{
  "schema_version": "ade.external-proposal.v0.1",
  "proposal_id": "proposal-demo-001",
  "task_id": "task-demo-001",
  "base_state_digest": "sha256:8a30d1e96c7f3b4c4b7c2e83a9bbbe3a670f4da4f41d237d99211bf4db517a26",
  "proposer": {
    "kind": "software",
    "label": "external development client"
  },
  "status": "EXTERNAL_PROPOSAL",
  "rationale": "Reuse one validated immutable result for multiple consumers.",
  "claimed_outcomes": [
    "Lower total processing cost for repeated consumers"
  ],
  "accepted_knowledge": false,
  "operational_grant": false
}

